AT_USER Showering is overrated  Soaking up time with your kids is much better  esp  since you ll be leaving them soon ,neg
AT_USER Are you serious  Please tell me you had a tall glass of water juice waiting for you ,neg
AT_USER yeah i sure do  I know this rain wont STOP  How depressing ,neg
These shoes are beautiful  but they hurt  I have been wearing them since 10 00am  Bad  Idea URL,neg
had a good interview     but the place looks so      DRAB I felt like I was waiting for foodstamps ,neg
Romantic weekend just came to an end  Sir has left for work  ,neg
is cleaning Ed s room to bring him back to HARK    poor Ed ,neg
Woke up too late for a run  At the opticians now  Got a wait of about 45mins  ,neg
Brought cat to specilist  May be ectopic uritors  Doing ultrasound  Surgury would be  gt  2000  may need to take him back to humane society ,neg
AT_USER got any jobs going   heh    i need to get over to the uk   i wanna see oasis  kasabian  the enemy etc ,neg
AT_USER i know what ya mean i inherited my dads short jaw  so it made all my teeth outta line ,neg
  gt  AT_USER my poor Spanish leaves me completely dependent on AT_USER  amp  others to tell what is going on in Spain ,neg
I do not want my man to go to Cali  Having a good job is such a double edged sword ,neg
I think that 8 pork tenderloins is overkill for 13 adults   4 small kids  So much food will go to waste in this beach house when we leave ,neg
AT_USER sorry  That s a no go  I work at 5AM tomorrow ,neg
AT_USER URL   Oooh  i can t see your pic Leisha unfortunately But at least alizippy can  about 25 times    ,neg
AT_USER Oh  don t hurt yourself   ,neg
AT_USER we could be seeing christofer drew right now like this is depressing  instead were connecting a piece of literature and abook,neg
AT_USER    B c you haven t designed one for me   let alone swim trunks      Week of show   Are you ready  ,neg
I WANT ANOTHER DAY OFF     To much Sh t to do today  Got a  quot new used quot  futon   and is going to get a  quot new used quot  dining table  ,neg
AT_USER I don t have any ,neg
AT_USER I didn t get a servey  but you would hope they do given that ppl are taking the time to fill them out ,neg
AT_USER hahaha omg i only got 3 hrs of sleep ,neg
AT_USER Anderson Cooper does post WAYY too much  I had to stop following him  Breaks my heart  ,neg
watched all the back to the future movies   its almost 2015   where s my flying car  ,neg
AT_USER to   Ashfield or something  I m sure i d still feel the same way there ,neg
Back at work and getting into the swing of things     I think the post holiday blues are setting in already ,neg
i worry too much sometimes  ,neg
Laphroig sent me an email talking about the 18 yr on sale in their friends store 12 hours ago  It s all gone  ,neg
I somehow lost my cell phone in between TJs in the Udist and my house  Have you seen it  ,neg
AT_USER sry ur sick ,neg
megan   IO DOES UR DADDDD HAVE SWINE FLU ,neg
is it going to be a loooonnnnnggggg day        dont wana clean today wana play ,neg
AT_USER Yes  I feel the same way  If the house is chaotic and messy everywhere  I shut down Clean house  happy  inspired mommy,neg
AT_USER AT_USER This is quite realistic imho  U reach a point where u hav to make progress  or move on  Even if temporarily ,neg
AT_USER I missed it  did you  I refreshed that dang page all morning  and then I STILL missed it    No free lip balm for me  ,neg
AT_USER AT_USER I found an 8 pack of it once  but it was the last one on the shelf  Haven t seen it anywhere since ,neg
Bryce is seriously god at beer pong why can t two drunk people beat two sober people    Hmmmm I wonder   ,neg
AT_USER i really really really miss my brother too but mines not in japan haha ,neg
Twitterers  im gonna do something pretty drastic tomorrow  It s pretty heartbreaking actually  Wish me luck  ,neg
AT_USER I envy you ,neg
AT_USER aw hope you find that cookie ,neg
 I m Bored    Bored    Bored Again And Developing A Headache And I Want A Piece Of Carrot Cake mmm,neg
AT_USER awwww  not on your birthday    ,neg
shame go back to school tomorrow after a week off at school i don t wanna go back BGT YEAH DIVERSITY ha i knew they would win screw susan,neg
courseworking in college FAHK,neg
Okay i don t like sharing you ,neg
AT_USER Sorry to hear that ,neg
My brother is left alone with my computer during the day and suddenly Last fm says i ve listened to week s worth of Linkin Park ,neg
is sad that becca isnt going to demi s show ,neg
just brought my mood down a lil    ,neg
gahh  i need to go to bed  i feel like crap right now ,neg
Why is my brother home  ,neg
This place blows  My UberTwitter isn t functioning here  Had to switch to TB ,neg
being sick really sucks  ,neg
passing out  8am labs suck Emily s last day in Va tomorrow ,neg
rawr rawr  ahh im at young alices house  but i have a headache  and i want to be at home in my bed ahh well x x,neg
I really thought bout callin in sick today    Already miss my bed ,neg
Oh  Emm  Gee  I just saw sometimg rly sad ,neg
configuring things ,neg
Listening to a banging tune on The Vault  Dunno what it s called though ,neg
Back from Urgent Care  AT_USER will survive  No good drugs given ,neg
Morning twitter  Trying this morning people thing of coffee again  Not sure its doing anything for me  ,neg
starving shit,neg
 Just    ,neg
really not feeling 100  today ,neg
AT_USER Should I re install it  Last time it was buggy as hell ,neg
im not having a good day ,neg
AT_USER I am lost  Please help me find a good home  ,neg
Tokyo weather changes fast  it was sunny hot ystrdy and this morning heavy rain  oh boy     makes commuting to school difficult  ,neg
lunch time twitterville    my dad s gonna leave in a few hours ,neg
cant sleep   rainy moving day ,neg
where is duck tales  amp  tail spin     ,neg
AT_USER for reals ,neg
Wrll that one went surprisingly well  How disappointing  ,neg
 AT_USER yeah    she s in hospital she s ok  but it s pretty fucken psycho that it actually happened,neg
 I has sazzy s cruddy disease  i feel so sicky ,neg
Why my mother dislikes me soo much ill never know i just know i try  just not enough i guess  ,neg
up early to get work done  but class site is down for maintenance URL,neg
AT_USER Cause I got it that I haven t truthful friends and I was crying long time  lol ,neg
lost at county ,neg
AT_USER Sorry about the losers ,neg
Someone does not love me ,neg
AT_USER ok it doesnt matter u sleep at urs friends house ok i will ,neg
Hate how boring mondays are  ,neg
Still in Anchorage   less than 24 hour window to deliver more than 5000 miles away  Things are looking bleek    ,neg
in the bed   still sick    ,neg
some beeing the key word    now it s gone ,neg
Today is not a cute day  School is so boringg  why wont teachers make class a bit fun   I just wanna go homeeeee  amp  rest  ,neg
Going on in 5 min not a whole lot of peeps here oh well still gonna rock it,neg
   workout was tough tonight  I can tell I took a few days off  ,neg
AT_USER They re so cute  I don t understand how people can eat them  ,neg
I need to pass out   But the light won t turn off  I hate timed lights  ,neg
Computerrr  Gosh  Its been so hot out i can t run ,neg
SLAP   2 dem girls trickn guys wit fake booties  n wurn wonder braws makn nem thangs look bigger den yall take da clothes off n its like ,neg
my head hurts ,neg
Blood test today ,neg
so stressing ,neg
AT_USER trust me you do not want to drive in this    ,neg
AT_USER no  not right now ,neg
Would like if my car ran ,neg
AT_USER Well yes  Shame that you can only get the plastic one for the first generation  ,neg
AT_USER omg yes I remember her telling me that you came now smh          glad you didn t PAY then haha,neg
AT_USER no one will answer me  haha i am unloved ,neg
I dislike Faizal more  amp  more  I love him  but what he had done  really make me damn sad ,neg
year 11 s at my school have officially left now  well about 1 or 2 minutes or so hah but omg jade and jayden gonna miss them  ,neg
im about to be ooooooout  then off to the DMV  i got a ticket ,neg
Wow  I m getting tweets an hour late  What the suck  ,neg
gotta say loving this weather im all burnt hate being at work when its so nice out wanna bne in the back garden chilling x,neg
AT_USER I hate projects too  ,neg
I wanna go to the beach tomorrow  I wish I had a car ,neg
AT_USER not sure why I m tweeting at 4 in the morning How s LA ,neg
AT_USER Its not fair making us wait for the result  BB,neg
AT_USER i like squirrels ,neg
i wonder if I llhave the time to celebrate my birthday this weekend ,neg
My pinky toe has went black and curled under the rest of my toes  I fear he s dead ,neg
im very tired ,neg
so hungry   but i gots no food   WTF,neg
i really want a kitty  probably not gonna happen though ,neg
Trying to get my Dell S2209W monitor to work with Ubuntu  no go doesn t recognize monitor   can t find drivers either,neg
i woke up early and i feel like shit this octopus flu is getting ridiculous  lkasgjksa lga,neg
gorgeous sunny day  really want to go outside  still not sure i can walk on my stupid ankle  i need a wheelchair ,neg
AT_USER nooooooooOOoooOooo dude i just got ur message  Its cool though  annexx just finished ,neg
So much for that  Wow  What a bomb  ,neg
sambata   gratar  duminica   chipsuri  azi  chocolats  what the hell i really deserve to be slapped ,neg
oooh  my ovaries ,neg
Am feeling missrable as im having side effects from my medication for my joint probs  Look s like my pill s will be changed again ,neg
AT_USER I got a mere 93 percent I m not as cool as AT_USER,neg
AT_USER they make some cross trainers amp  I think some neutral running shoes in lime green  but I need stability ones because of my knee ,neg
Japan is treating me good as of now   don  t know how long ,neg
AT_USER Well then wall me now  Hahaha I know  our plan last friday didn t push through AGAIN  ,neg
Chillin getting ready for work  ,neg
AT_USER Aww My sis saw the first episode and she liked it  funny cuz shes not into the whole  quot vampire quot  thing hahaha  Grownup twilght ,neg
Grr feeling crappy today   In work wearing sunglasses and a hat  It s too bright and no I haven t been drinking wish I had  p,neg
Twisted knee at 3am  spent all night in absolute agony  So much for the 10k tunnel run ,neg
AT_USER no  she lives in australia  but i spoke to her so it was pretty good  ,neg
Dammit I may have the fuckin flu ,neg
Plane over my house right now   and I wish I could be on it I wanna go places NOW   I can t wait 2 weeks  it just feels so long from now ,neg
AT_USER Simon it s been far too long Fi said Thurs suits you for coming out here  You should all come and we ll eat ice cream  xxx,neg
V  gt  bol sok embert l  ttuk de lovat nem  Costa Coffee ben az Iced Cappucino nem   des ,neg
  sigh   sometimes i just wonder what im going to do now that my world got turned upside down literally a week ago ,neg
sadly brother told me there are no skateparks where he lives  BUMMER ,neg
Kinda wished we were going to play some soccer today    ,neg
Why SEX stuck In your head  Heyyy  Your too young for that shit  Oh wait your all grown up now not my lil nettie no more and bday se    ,neg
AT_USER Poor Baby I still love you  lt 3,neg
AT_USER aww I want to come  stupid living in a different state  ,neg
AT_USER shes been such a bitch to me shes like  your stopping everyone fr4om learning  but really everyone started drawing on me ,neg
Being sick sucks for everyone ,neg
I just saw 22nd of June and it make me think of Jenny I miss her so much    ,neg
I forgot to write 400th tweet At 417 now  oh well   ,neg
About to start moving things into my new cube ,neg
I wish she was here to cuddle fuck,neg
AT_USER ha ha is straight  Want to watch a movie but DVD player broke   So how was ya weekend ,neg
The weather is shit ,neg
AT_USER at least you have a life to write about  mine is confined to house at the mo ,neg
AT_USER i like that 2  mysp nvr said that 2 me ,neg
AT_USER It does I m sorry ,neg
Grr Mitchell  amp  Webb Look episodes are messed up ,neg
About to go to bed  Well  shower first  but then bed  First formation at 5am   sigh  I miss my husband dearly  ,neg
AT_USER all these girls are so happy you just made their night   me on the other hand couldn t even get thru ,neg
Homework history and latin 3 weeks school and then vacation ,neg
Starving  Last batch of bananas doesn t seem to be very good  Only getting 1 3 of nanner in my tummy  ,neg
AT_USER I have a throat infection  I ve been told to stay home tomorrow so I won t be there to cuddle you or put pubes on your desk ,neg
AT_USER what is wrong with u         gahhhhhhhhhhhhh stupid boring boy ,neg
can t put this filing off any longer    ,neg
I m not wanting to work  want to be back in bed  Download festival was amazing     so much sun and wicked music  wish i was still there ,neg
AT_USER life sucks  I hate work and not having money ,neg
It s summer  I ve barely done anything    and I m already exhausted  Lame  ,neg
Despite a high speed internet connection  a new HP laptop  a PSP  and an LG Voyageron hand  I feel I have nothing to do on my break    ,neg
And there goes the rain ,neg
Interviewed dad for research paper and came to find that my phone never recorded his long  detailed response at all   whimper  ,neg
Why is it soooo COLD    I don t want to get out of bed ,neg
haha i hope he doesnt kill us ,neg
AT_USER Interesting 2 things  1  Kwn still doesn t show up in users I can add a column for  2  I hit rate limit after 2 tweets  ,neg
grrrr  i never win ,neg
AT_USER too bad Hope u can post it soon ,neg
AT_USER I missed out on carrot cake last night  Hope you had fun AT_USER,neg
is pouting and sad  The opal from my favorite ring is gone  I think I m going to cry dammit  D ,neg
I like Bing com s gorgeous photo background  changes daily   but I don t like its current ranking when Bing ing our restaurant s name ,neg
AT_USER Yeah ,neg
Sometimes i begin to miss the angels in my life  I settle down to intense poetry ,neg
my mom stole my baby     i guess that will make running errands tomorrow morning much easier  i still miss him tho    ,neg
AT_USER what tonight   We got a bday party in LA tonight  ,neg
Trying to write chapter 135  not really getting anywhere    ,neg
i hate how twitter wont let me post my facebook group link ,neg
i can t even open my eyes from crying so hard    no sleep  no break  no mom ,neg
getting materials ready for a mtg this afternoon   wish I took the time to write down more things   my memory is failing me ,neg
You know what I forgot to do after reinstalling my operating system  Yeah  I forgot to install Skype  Closed show tonight  Sorry ,neg
AT_USER yea its annoying me ,neg
a lil mad that a lot of my friends did show up at my grad party    not even for a quick hello or anything ,neg
is finding twitter weird    ,neg
Also  it s a shame that the first night of DCI is getting rained out at Rockford ,neg
Hurray its snowing in June ,neg
revising so hard that i ve forgotten to eat ,neg
Gears of War 2 Double EXP weekend is almost over Too bad I didn t really get to take advantage of it,neg
is ill with chicken pox atm listening to music XD but rather bored works been sent home so doing skwl work to ,neg
FACT  Alex Can t Go To TGP ,neg
is too busy to plurk    URL,neg
AT_USER You should have come into the hospital I was working at  I could have nursed you   ,neg
So super sunburnt  its killing me  ,neg
AT_USER i want a cat like Marvin but my papa is allergic    And it just wont be the same if i shaved it xxxxxx,neg
AT_USER yeah  Jonathan told me himself  ,neg
AT_USER Oh  I totally want to see Star Trek  But Kristine had already seen it with her hubby  ,neg
Xfiles disc doesn t work   Rippin ,neg
URL   Leaving Paradise ,neg
just finished washing a big pile of dirty laundry  gotta pack for the trip to langkawi later and my is body is aching ,neg
AT_USER whaaaaaaat   the morning after ive left   no get here thursday ,neg
Heading to Beeville today  Byron s not feeling well  ,neg
I need to see a sleep dr about the position i sleep in  I have a sore red spot in the middle of my forehead from it  ,neg
Reading the 10th and final Pendragon book  It s exciting bc I finally get to find out what happens  but also sad bc now it will be over  ,neg
AT_USER I wish you d come to Ohio ,neg
At the bank trying to figure out what s going on with my account ,neg
BUT because my comp s started to run slow I guess it has to be done  ,neg
Busy afternoon  At least maybe that means it ll fly by  Also  my boo hurt his baby toe really badly  Please pray for AT_USER ,neg
AT_USER I knooooo ,neg
what is the difference between mitosis and meiosis   gonna fail tomorrow ,neg
 too scared to sleep  Watch too may damn silent hill videos ,neg
i really hope nothing bad happens today  last night scared me ,neg
Another early morning   I m sooooo tired   ,neg
hate work ,neg
Just saw a dead deer off to the side of 295 ,neg
Dana   quot You are like the Asian version of MK today  quot  Forgot to take a pic for my blog  anyway watching Double Jeopardy ,neg
Twitter   Just got back from the social studies exam  it was hard But i m still guarenteed to pass  ,neg
AT_USER Too bad you couldn t come  Still awesome though  Oh  and I hope the survey works out today  eager to fill it out ,neg
urgh still sunburnt and avoiding the sun stupid exam this morning  lovely,neg
I ve just shit I thought it rang  ,neg
My feet are cold  ,neg
2 follow me  come on   follow   ,neg
AT_USER i suppose u made it to tulsa ok  tried to call u back earlier but u don t love me  ,neg
AT_USER How did you do it  I really need to take about 20 lbs off    it s so hard to get the motivation  though ,neg
iPhone twitter clients and Push URL not in the near future ,neg
AT_USER Me but i dont know my account number ,neg
wants to go to disneyland today  am I the only 1 that didn t have work today  ,neg
just got frozen outside the U N building  Hallo  It s a Racism Conference and you let Kat go in but not me   wawawa ,neg
I miss you daddy  for real for real   you fell asleep on me ,neg
working wish i was sleeping,neg
My Gmail is down ,neg
Will Ferrell was on Man vs Wild this week as a promo for the movie  The Wild didn t win unfortunately  ,neg
Waiting on Ashleigh to get here  i feel like crap  ,neg
I can t believe people sometimes  Greed and stupidity  ,neg
I didn t get McD s breakfast because I didn t answer my phone ,neg
im sooo bummed that im not gonna be here for the formal   ,neg
AT_USER ALF    I DVR that  but my mom always deletes it for her COPS episodes  he was my fav ,neg
Still waiting    def not updated every 5mins ,neg
AT_USER disco flu  is that something you d catch from disco Stu  genuinely sick ,neg
Phil and Fern looked great  they are a great team together  going to really miss Fern ,neg
Today was my dad s birthday  ,neg
has a huuuge headache  omg I feel like crap  ,neg
Been at work since 6 a m  I wanna be in bed     w  Donnie W  would be oh so nice ,neg
Especially with AT_USER driving  always fucking speeding  killing the damn gas     ugh frustrated bc I m so fucking tired   ,neg
AT_USER oh crap  you re gonna be gone alll day  then  hmph  boring day is boring here  hubby is studying  rj is playing a vid game  ,neg
pleased to follow AT_USER AT_USER  per armano      i have a   about my 3 yr old   1200 Dell Inspiron that s now dying ,neg
is sad  can t find my socks    URL,neg
looking to pull an all nighter  my dad goes to work at like 5 30 so im gonna hitch a ride with him  3 hours left I MISS MY BED ,neg
 cant sleep    wishin i was wit AT_USER i love youu    good nite twitters  ,neg
Shitty friends stink ,neg
AT_USER You might as well  There ll be plenty of cam edit time tomorrow  on the other hand am still slammin  red bull  Lotsa work,neg
glad the boss is out this week  but not glad that I have all his work to do too ,neg
AT_USER yeah the weather ruined my plans too i was gonna beach it up as well,neg
AT_USER   are u really quitting hannah montana after this season is done  ,neg
AT_USER I AM FAT YOU BITCH have fun in science  lolololol,neg
I miss my frat boy going rock climbing and then nothing ,neg
AT_USER about the im in miami bitch   ,neg
AT_USER don t jump on the hd bandwagon just yet   i ve heard the hd series 3 ones are buggy ,neg
AT_USER and this year I have summer school  ,neg
Missin the boy  ,neg
I think my chair is telling me I do too much chair dancing  One of the arm spindles just broke ,neg
  such heavy traffic  I m hungry  ,neg
Twitters it brings a chill down my spine just to think I have to sign out  good night all But I ll be back at 7am tomorrow xoxo ,neg
AT_USER that is too awful to think about poor Kingsley,neg
Is hugely annoyed a a stupid direct debit taking me overdrawn   multiple bank charges on the horizon     ,neg
headin down to arkansas tomorrow for father day weekend  however  no iphone this trip down as previous thought ,neg
I need my own apartment and about a couple thousand dollars to decorate it ,neg
Need a temp car  Anyone selling one  Cheap ,neg
Today  I ll get my  wisdomteeth extracted     FML ,neg
thunderbird replicating my gmail inbox on local    taking time   ,neg
i think i m sick somebody make me some instant noodles ,neg
My arms hurt  I hate hammer curls  bicep curls  cheese curls  press n curls  jheri curls  anything that curls    ,neg
Vodafone text fail  I made a really interesting update about 1pm about becoming a plant seller  Gone forever  ,neg
AT_USER ok  here s a half assed shot by the pool just now  iPhone not too forgiving URL,neg
AT_USER I do believe the number is closer to 3400  ,neg
Excellent motorcycle ride today  now let the sneezing begin ,neg
So the homecooked dinner went well  just watching Katie and Peter  I m still really sad that they ve split up ,neg
Cleaning time fag first     anyone want to help ,neg
I want to travel   I wish I had money  ,neg
i really need some money  i don t have much left  ,neg
Hiding in a door way from the ridiulously heavy rain that just start   Coatless URL,neg
AT_USER No  never They haven T been to Germany yet but I heard the wanna come here soon    Wuu2  x,neg
One exam done  one more to go  Dropped by my journalism class to say goodbye  Im gunna miss journalism ,neg
No starbucks in cross city ,neg
Didn t see The Hangover last nite was sold out  Gonna be Emma s model tonite  Gettin my hair done,neg
trying to study for examss ,neg
ok  goodnight all  have bad headache  bye xx,neg
Is tired  I was walking     walking     and walking  ,neg
AT_USER Does he look fat  I can t believe the hated Dodgers keep winning ,neg
Hey Tywhitt y haven u asepted my twetter friend request ,neg
AT_USER think of happy things like     ummm    exams  GOOD LUCK by the way  and twill all be over soon  hope the crankies leave ,neg
AT_USER Lots of hugs coming your way   hugs  ,neg
Bah    Ghostbusters game is released  and here I am without the time or money to play it ,neg
Floyd leaving for SG tonight  URL,neg
AT_USER Yes  you are correct   My Dad us not here too  ,neg
AT_USER Hellll yeah  I m fucking jealous  lol  How was the bbq  Yet another story the guys will tell but I won t have any say in ,neg
AT_USER That would be nice but you have school have fun in intro comp  ,neg
Back to studying  Boooo ,neg
argh  i don t wanna pack  i don t wanna leave here and i DON T wanna go home ,neg
AT_USER who we gonna blame today now    ,neg
omg I just remembered its monday  was scrubs on 7 tonight  ,neg
They re doing it now I seriously need a lock for my door ,neg
needs to not be working late and needs to be headed to church  ,neg
I m sorry for your loss ,neg
AT_USER URL   ooh pretty  much rather be looking at flowers than doing uni work  ,neg
What a weak ending  But hurrah for more hominids  No confirmation of Se4   just a blurb for Buy Our DVD set  Primeval  abbyspants,neg
AT_USER that link is not working for me at all     it will not load ,neg
AT_USER thanks buddy,neg
early morning tomorrow ,neg
Are you okay  ,neg
Dani and I are digesting latest report from specialist  ,neg
It looks like there is going to be a big thunder storm  ,neg
I m Watching The Dark Knight movie   Awesome movie   It stinks that Heath Ledger is not here with us ,neg
Amazing Zombie make up  URL Missed out on the event yesterday  Bummer ,neg
AT_USER Ohnoes  patpat ,neg
I cant believe that they left us  that is so sad ,neg
i kinda suck at life  i need a change  A really good one ,neg
I MISS RACHII     WHY DID I DUMP HER UGH    IM SUCH A TOOL SOMEONE HIT ME,neg
OMG school is so annoying it s takin forever    i wanna go home  i haven t been able to catch up on  Robsten ,neg
working on homework all day ,neg
AT_USER oh babe  sings you a lullaby   quot sleepy girl sleepy girl o why won t you go to sleep    quot    Friends  Phoebe s dad to baby Phoebe ,neg
AT_USER emang   nenek2 nya udah serem menjijikan lg    ,neg
Hate hayfever ,neg
AT_USER it is ,neg
Morning twitterland   Happy fraking Monday  ,neg
Insomnia   grumble   need cure   this is getting out of hand now    grumble    ,neg
got amazing pumas but wants to return them and instead get this beautiful green juicy purse  ,neg
has to be up early tomorrow to fly out  sucky sucky ,neg
AT_USER You poor spunky   its so sad   my Rotti made it to 10 and I had to go down the same path    I know how you feel ,neg
AT_USER I m keeping things apart from me and I used to have nightmares  that people would come and get me  Although I will think sun  ,neg
AT_USER looks like rain over here ,neg
Apparently I lost all of my CDs sometime over the years    Give or take a few  ,neg
AT_USER Hmmm  I hope it doesn t go cold Got the Saturdays on Tuesday  but more excitingly  it s Rent on Wednesday ,neg
