"@chlostick my hair is terrible too and I miss brisbane  I wanna go backkk. Next time I am back is when Aiden comes back (B4 Green Day)","neg"
"Firefox keeps crashing on me  updated yesterday","neg"
"Ok so I'm paying for it today ","neg"
"@jephjacques  the birthday girl didn't get a mean tweet...","neg"
"I hurt my ankle in my own house wearing flat shoes clumsy, retarded me. It hurts sooo bad I can't drive ","neg"
"Hmm were some of you sick? I think I have a cold  Worht it though! Love you all! &lt;3 xx","neg"
"@jordanknight been trying all day but I can't get to the site to vote ","neg"
"@Malarkey the biggest step forward I've seen recently is the &quot;Ditch IE6&quot; movement that is not growing very strong... So - afraid not ","neg"
"My surfing mentor was sick...no surf for me today ","neg"
"i hate when im somewhere where it's hotter than 73 degrees. i need to be in AT LEAST 73 temp at all times.  And i live in florida. ","neg"
"gaaah!!! my blog does not open for only me! it's been taking like ages to load up! so much for the new post and to know how it looks! ","neg"
"@billfer oh how I wish I could work from home with just my #g1. I'm too much of a grunt at work to warrant a laptop so I can work at home ","neg"
"this week is not going as i had hoped ","neg"
"@jemelehill I wish we cld get shows on TV tht aren't always promoting Ignorance at times.I'm over the stereotypical reality shows  so sad","neg"
"Wolfram Alpha can't count to three  http://bit.ly/UY9Ib","neg"
"@shinerweb thats clever of them ","neg"
"morning twitter.. no, i'm not going to say good morning that would be lying if i said it was a good morning.. i feel like shit ","neg"
"ar mate ive got no chance of winning that topshop competition now  booo.","neg"
"Wishing The weekend wasnt so short ","neg"
"Ridiculous amout of pain right now.  Totally unnecessary if u ask me.","neg"
"@aada Try to have fun, even though it sucks so badly ","neg"
"Misses the DB crew ","neg"
"http://www.300mbmovie.com may be a good choice, but i don't have repi ","neg"
"@2lsquared I miss that!! No place like that where I am in staten island  did u c the @glamazonsblog tweet about u???? Sweet!!","neg"
"@TheRealSolo, Yes it does.  It turns smiley faces upside down too ","neg"
"Going to bed very upset  in which i normally wont do but I dont  have any other Choice..Sometimes its just out of ur hands...","neg"
"@jBonnes I went to lecom FL for two years. then i got sick &amp; had to withdraw. ","neg"
"Just checked my user timeline on my blackberry, it looks like the twanking is still happening  Are ppl still having probs w/ BGs and UIDs?","neg"
"@UFC  so much blood there was no way clay was going to win that round ","neg"
"Aching belly ","neg"
"is ill.  outside is beautiful weather, and i cannot go out.. :/ i hate this..","neg"
"Why must I always fall for da small boys ","neg"
"@DawnYang1 i'm so sorry to hear that. my grandad is also suffering from cancer. its sad to have a loved one suffer. ","neg"
"@calosa huh.. that celeb-architects. ","neg"
"@fabispereira we need to go shopping together!! ","neg"
"have mercy on teh poor read ball please - it has a little sole too .. Don't hit It -   #PakCricket","neg"
"Unfortunately, we're selling the locker too ","neg"
"Real mad my net stopped working outta no where currently on the phone with Verizon Tech support ","neg"
"#Air France my heart just breaks for those families  2 bodies found","neg"
"oh my got a headache from hell from last nights party..i just want to sleep but hey duty calls (work) ","neg"
"Couldn't find Echoes Pink Floyd on Blip.fm sorry lads guess you are disappointed 2 ","neg"
"uhh can i take the &quot;my mommy is awesome&quot; comment back? b/c she just implied that i looked fat in bubble dresses. thnx mum. way to help. ","neg"
"@gi_ri_ja  it sucks, doesn't it?","neg"
"I'm guessing that oil is just going to go down today, so I will be ","neg"
"packing up, ready to go... back to school ","neg"
"Gym ! Then Working eight hours  so excited to sleep tonight!!","neg"
"@MyroneTadrid  aw her latest &quot; selenagomezLast day of shooting... Goodbye Canada. &quot;","neg"
"@mikasounds hope y'all have a great night in A'dam still  can't b there...maybe next time!  (and you win...applied 4 visa ;)!!!!!","neg"
"has neglected twitter. sorry. ","neg"
"http://twitpic.com/7r3yv - We are on the second look and the store we wanted to shoot in front of is closed ","neg"
"http://twitpic.com/7zvv9 - this is why i wanna give up crafting. super fail, incomplete stuff, aft hrs &amp; hrs of work. ","neg"
"i think i'v got the funk, and not the good funk.  stupid nose and throat. ","neg"
"@loritodd I can't, I have class tonight  U going? Have fun!","neg"
"gotta work on Saturday ","neg"
"Heavvy heavy migraine! ","neg"
"watching american idol in tears ","neg"
"watching my favortite news channel @kron4news because I cannot sleep AT ALL ","neg"
"@tristanrogers Keep the bubble tweets coming they are the best!!! GH was great when you were on .. what happened? ","neg"
"though i was disappointed that @KavuBob spotted my cunning placement of @cdmilligan's leftover tat on his desk quite so quickly ","neg"
"Plumber here adding &quot;additional drainage&quot; ordered by condo board. Cutting a big hole in my kitchen cabinet. ","neg"
"I am seeing alot of pleated khaki pants ","neg"
"@AaliyahLove69 It\'s an evil weed. I have them too and Molly gets them when she goes outside  http://yfrog.com/5bk3rj","neg"
"Sucks that Fios doesn't have NBA tv its the freaking playoffs ","neg"
"These messages are teasing me! It isnt fair. ","neg"
"@ArieleMoonfire It just sucks.  We lost our vacation photos &amp; I had about 50,000+ words I'd written in three different novels. Just gone.","neg"
"Oh. Freaking duh. Just subtract 18 from 39. Jesus, and I'm signed up to take AP Algebra 2. I'm going to fail. ","neg"
"Finishing Extremely Loud and Incredibly Close and laying down. I would say text me but I won't have a phone til I get my charger tomorrow ","neg"
"workin night shift is a nice break from the busier shifts but i miss my nighttime loving and sexy man sleepin beside me   boo","neg"
"has just finished work and wants to sleep  bed please ?","neg"
"yay im on my internet was down yesterday  But now im on ","neg"
"I don't know it...looked on youtube and blip...can't find it. ","neg"
"@Jazzled4life Sorry to get your hopes up ","neg"
"tweeting just ain't the same without my phone, I miss you little guy. ","neg"
"5 cents for plastic bags at grocery stores now  If we stop using plastic grocery bags , what are we supposed to put garbage into?","neg"
"@Irishise Shoes no longer a team member ","neg"
"@techiekat i wanted to watch britney ","neg"
"Can't tonight I'm working ","neg"
"Cat 1 needs to have dental work done again and may have to have more tooth pulled  Cat 2 not happy this means more toothbrushing for him.","neg"
"going to bed..work &amp; babysitting tomorrow ","neg"
"12:15 am and we just finished playing monopoly......I suck at this game!! I was the first one out ","neg"
"so tired... i need a good nap ","neg"
"@logan_weisner What time is it in Dubai? It's nearly 6am and I STILL can't sleep  Do u want me to pick u up from airport?","neg"
"Had a really fun day at Ordina Open.. still a little bit in shock about what happened to Marcos..  So sad &amp; scary to see!","neg"
"is confused... ","neg"
"cant  believe i almost lost him today ","neg"
"has been on drugs and tea all day ","neg"
"@ChiNurse the economy is on all our backs.  I'm sure he has your will and goals which will help him gain employment.","neg"
"No phantasy star yesterday  going to work...","neg"
"@Danielle_Jane14 don't cryyy  just don't speak to him and when they ask why just tell him he's not worth ur breath lmao it's mean but  ...","neg"
"Omg its thundering and raining really bad now ","neg"
"@Placehold stormy and cold here, south of france has really changed  I'm moving up north!","neg"
"Argh, I am going to the dentist tomorrow  not fair, nothing is wrong with my teeth (I don't hope there is)","neg"
"Hoping that GM would be able to renegotiate with unions after bankruptcy.  Not looking likely now that the Union owns 17% of the company ","neg"
"@findo yes. But I'm a long way away. ","neg"
"@MikeyPod so sorry to hear about the bite   are you ok???","neg"
"@TonyJPRoss &quot;The new Regina Spektor album is half really good and half not so good at all.&quot; Just read that from Perez Hilton!  ","neg"
"it's bad weatehr again  and even my borsalino doesn't make me warm enough to wear my jeans shorts, and i was so looking forward to them","neg"
"#iremember hoping someone would follow me ","neg"
"last playa standing I guess...  lol","neg"
"@angie3b3 Sisss guess wat? TaJon Just called me. I still can't breathe. ","neg"
"is going to watch Marley and Me with Diesel ","neg"
"Cv joint went out on the way to leave topeka... Guess I'll miss that wedding. ","neg"
"Tomorrow morning I'm goin' to have another check to the dentist...I'm so scared ","neg"
"@svtcurious I use to love &quot;HEROES&quot; the 1st season was amazing I own it! But then season 2 sucked and I missed 3  but yeah he is!","neg"
"Hey @jonasbrothers CAN YOU GUYS SHOW THE BOTTOM OF YOUR FEET? IF YOU DON'T I'LL BE SO DISSAPOINTED  ATT. YOUR BIGGEST FAN #jonasliveonfb","neg"
"I'm bummed out that I'm sick of Jon &amp; Kate. I've watched them from the beginning. ","neg"
"Head hurts. No caffeine  tired. I'm going to sleep.","neg"
"craving iced tea.. but all we have is orange juice ","neg"
"me and scarlet did a bad thing this afternoon  may the dog spirit rest in peace.","neg"
"@socalgurl83 Yeah I felt really bad because this morning before I knew, I texted her and wished her a happy mothers day ","neg"
"time to take him to his watery grave ie. the big white bowl in the sky. Seriously ","neg"
"my cake is slowly caving in  it never happened to me before. it is like watching a disaster movie :/ i feel so helpless and afraid.","neg"
"MacBook Pro back in action after second logic board in as many years  #apple #fail Don't get me wrong though I wouldn't have any other","neg"
"Missed the train I wanted  bloody taxi being late!","neg"
"I don't feelll gooooooodd ","neg"
"I got my fella sick.   Someone put me on an island alone!  WACK","neg"
"Watching another stupid sunrise.. This is getting to be to hard.    ","neg"
"Do I really look like the gay guy with the dark hair and sleeve from #BGT dreambears? ","neg"
"=/ twitter goes down at 10pm my time ","neg"
"@deon Nope that doesn't work  problem is why it doesn't want to boot normally, the screen is black","neg"
"Oh, it's early ","neg"
"I truly have nothing to tweet about.  I haven't done anything in days.  Excited about getting out of the house for emissions testing. ","neg"
"@kyleskywalker ahh haha go ricky, ah yeah its fail so badly im so jealous of my friend that just got a job at eb games  hahaha","neg"
"@sugarmel PLEASE blog it, thanks for the tips, I shall try again... ","neg"
"Omg Sum Wan Help I Cant Find My Friends Page On Twitter ","neg"
"Daira needs to get in contact ASAP. .Not good news. . ","neg"
"Where is my camera? ","neg"
"@eurini Done!! Wehey! Got indegestion though  and HAHA! Please don't stop Lorraine!","neg"
"Ironing myy 4 work shirts. They are a nightmare to iron!  ","neg"
"@djjemz At what time are u going to the hotel??? , -- i just wanna sleep and stay home  ahahahaha","neg"
"went to the beach, now im red and burnt ","neg"
"@koalaxninja I totally wanted to go to that show tonight but my brother had his graduation ","neg"
"@shanedawson yeahhh!! and i cried ","neg"
"Uggghhh I don't wanna go to my behind the wheel class ","neg"
"@uknowulovemeh  just hope your ok anyways","neg"
"@tbeckett that sucks... hope he is doing okay.  We feel so helpless when our babies aren't feeling well ","neg"
"@cadlymack i want to meet sophia so badly ","neg"
"I can't seem to concentrate well today. sigh ","neg"
"and can,t have the ice cream or the apple pie  been doing so good at the gym ","neg"
"Superbikes were awesome...but I am paying for it today ","neg"
"Didn't really like Star Trek  Just didn't feel &quot;Epic&quot;.","neg"
"Can't eat, can't sleep, can't breathe... But I CAN update my twitter! I'm sickyy ","neg"
"@photosil Thanks. Yes, we do have the kind of weather over here in Germany that the little bugs seem to like  A lot of people are down.","neg"
"work..meh ","neg"
"it's hotter than yesterday! It's all our fault. ","neg"
"Im sick of not sleeping and im sick of whatever this fkd under eyes infection/rash. Its been over a wk, puffy n itchy ","neg"
"@drewryanscott Sorry for not being able to get your bday up on trending topics on twitter. ","neg"
"I need followers,, someone give me a chance im kinda loanely and upset. Got in a fight with my bestie, we arent friends anymore.  advice?","neg"
"@Ye_April I'm not sleeping either ","neg"
"@bevinkathryn Why the F did JK have to kill him off? ","neg"
"I haven't seen the sky this blue since Oregon. Pity the river isn't as blue here as it is there  more shopping trollies here too.","neg"
"looking at our Bora pics. I miss the beach.  And of course, the people I went with. :&quot;&gt;","neg"
"@iwilseeuinh3ll Oooh. The movie is pretty awful. The books are good tho... Makes me wonder if New Moon will b th same. ","neg"
"@oliviamunn looking good ;) shame it won't be in the australian issue ","neg"
"Too bad sleeping doesn't burn as many calories as exercise. ","neg"
"is about to take the SAT ","neg"
"@alistpromotions yeah i saw!! i miss thomas sooo much ","neg"
"@KateFry ive got special consideration for it cos of some stuff going on  so hopefully thatll help and i was on a distinction b4 the exam","neg"
"@Patural omg are you ok? ","neg"
"he said he likes that girl. ","neg"
"Still having trouble getting my icon to upload ","neg"
"I dont wanna go to work and leave my happy little otalia bubble!!!!!!! ","neg"
"ughh getting ready for the math regents ","neg"
"im lonely   watching the beautiful moon....and listening to &quot;the bset day&quot; i cried listening to it im such a dores","neg"
"@MsLierience I don't have a good partner to have fun tonight, he wants to go home ","neg"
"@irtimaled no picture but sound.... no red lights ","neg"
"has a sore ankle and calf from stoopid bitey fireant type things ","neg"
"not at Rockin Roots  I want to Taking Back Sunday and Anberlin","neg"
"@aussiemcflyfan i know how you feel ","neg"
"Damnit - - I *really* want to like sumo paint. But I keep running into bugs that are inexcusable, from a usability standpoint... ","neg"
"@emeraldjaguar with CA budget issues, they may not have school in the fall. or they'll start in october. ","neg"
"Emily Sarah Carp someone on fb chat os ognoring me  you know who u r! http://tinyurl.com/lpj5vl","neg"
"o im srry i didnt know ","neg"
"Sometimes it hurts that pets cant talk back to us. What if they are in pain. How would they tell us. ","neg"
"@marleykid i have too ","neg"
"Have to quit the movie business. All I do on set is eat eat eat... ","neg"
"I am so tired...need rest badly ","neg"
"@nemlah I wanted to go to BlizCon but no one gets what one wants ","neg"
"@ddlovato hope your voice gets better i really wish i could see your concert this summer ","neg"
"Is it true that Chrysler is going to be making only small cars now ","neg"
"finally tided my room ","neg"
"Finally finished uploading the Kidz Safari pics in FB. Now thinking of doing some housework ","neg"
"I feel like I'm physically gna be sick cause I'm tired, nervous, scared, hungry, claustrophobic + much more ","neg"
"...and once again, the shortened link doesn't work ","neg"
"@moonsy I reaaaaallllyyyyyyy miss it ... ","neg"
"@roxiijonas error  hopefully be working later :S","neg"
"Forgot my lunch. And my wallet... No cool subway special for me.  I declare today national starve-for-lunch day!","neg"
"i miss the beach ","neg"
"@shofiebot ","neg"
"I'm going to see HangOver tonight, but i'd rather see transformers. ","neg"
"Trying to get used to getting home later with new job.By time home i have no energy for gym.Must seriously rectify as feeling podgy ","neg"
"The only thing I hate about drinking is that I always wake up early. ","neg"
"@dannyjesse can you send me another friend request I accidentally blocked u ","neg"
"Oh...maybe not ","neg"
"@uyennguyen_ i know, me to  i looked at the time at 10:00 and i remembered it was on at 5  so i missed it by 5hrs :L","neg"
"is headed to work  i would much rather stay curled up in bed and just sleep today away not feelin very well at all","neg"
"@crystalchappell Strep throat is the worst, my last bout decided to mutate into a sinus infection  Feel better!","neg"
"waiting for my fajah to come and pick of some of my stuff; I'm gonna miss new haven this summer ","neg"
"I gag too much, my dog coughed up some bread and it was soggy and shit and I couldn't eat lunch  pathetic.","neg"
"lol wow people hate on people they dont even know, like @mileycyrus @JustinMGaston @selenagomez and @ddlovato i feel sorry for them ","neg"
"Leaving Lexington back 2 Louisville ","neg"
"Going to bed now, nothing to do.  Maybe all this happiness with bring really good dreams!","neg"
"@skibabe12 thats stinks. i got sunburned on my shins and my stomach  and i had sunscreen on!!","neg"
"@__MissB And yeah, I gotta say i was pretty shocked to hear about you and rob..  I hope it doesnt come down to that for me and james --","neg"
"@nvrpromise u work this sat its our 2 dollar tank event and we have to wear our flag shirts tooo ","neg"
"@PaulOrMond I'll let you off I guess. I don't know what I'm going to wear Friday now though ","neg"
"aaah a new day, the sun is shining, but work beckons. tired is not the word atm! ","neg"
"watchin sex and the city - drowning my sorrows about the departure of BGT ","neg"
"Ugh!  Been waiting for Kev for a minute and still nothing SMH.  ","neg"
"bored with red hair..wanna go back blonde now! ","neg"
"@ChrisKing23 Chris I keep tryna download Magnificent on welcometothecircle.com, and it keep sayin file not found.What should I do? ","neg"
"Is it sad that our gross, dirty handmedown futon is more comfortable than my own bed? ","neg"
"is sad that Couchsurfing culled both the flash &amp; html versions of embedded twitter feeds from the site, guess we were eating up bandwidth ","neg"
"well goodnight everyone  Please show me some love on my new video thanks http://bit.ly/FnALv","neg"
"Ugh. So. Tired. I took resumes around this afternoon in the burning sun. Ink coffee, chocolate factory, hire me. Please! Hate the b&amp;n. ","neg"
"really want to go to princess protection progam premier tonight but cant because of exam tomorrow ","neg"
"@EGDeedy how is it that I'm already following her but never see her in my feed?! ","neg"
"@danaamariee No she was walking past and that kid brendan costello was trying to talk to connor ","neg"
"HAVE TO WAIT!!!!!!! mums busy attending to my brother to give me her delicious dish!!!!!!!!!! ","neg"
"@radioalexander No, I saw her on Sat. But talked on Sunday ... I'm a bad son ","neg"
"happy mother's day to the best mom in the world...mine!!(L)(L) i miss her ","neg"
"I'm really missing my mom. I get crazy when I feel like this. Might end up on a flight back to Tampa tomorrow   http://twitpic.com/6sjgi","neg"
"Here once stood coolers full of FREE H2o, v8, Coke, Pepsi, MtDew, DrPepper, &amp; Sprite. As of today, no more   http://twitpic.com/6p6l6","neg"
"is Blues Alley gig cancelled. ","neg"
"woah had an incredible time at kings island!! on a sadder note...JON AND KATE ARE GETTING DIVORCED!!!!!!!! OH CRAP ","neg"
"Bummer, fever doesn't seem to be compatible with Dreamhost ","neg"
"http://twitpic.com/6ted5 - lollll my dog he just got um groomed or w/e, he's sad ","neg"
"just got home, pretty tired... all i want is a nice warm bath and a massage ","neg"
"Do NOT want to go back to work tomorrow  http://yfrog.com/5fsnbhj","neg"
"@Aybarz k, now your just purposely being a boobface ","neg"
"Busy Overtime Friday *pukes* ","neg"
"Signed off 4 the week. Chest infection &amp; cough. Bummer. That's £68.00 of commute expense 4 this week. Shame the weathers so good too ","neg"
"Wishing I was out biking right now... but sitting in front of a computer is just as good, right? ","neg"
"@gfalcone601 if i could, i'll go with you! ","neg"
"What a 1st round upset! Tony Schu done ","neg"
"im 2 tired to stay up for my 1000th tweet  mann lol its friday and 9:20..ugh im so lame haha","neg"
"@KristinRose84 I know. ONly works on mobile- but then I get so far behind I skim, and still miss out! ","neg"
"will be out for the weekend...  http://plurk.com/p/x3lhq","neg"
"my feet hurt,i have blister  too much of a DRUNKEN extremely drunken nite,the morning after is always the worst! damn Alcohol!!!!","neg"
"@dhabz I'm sorry   they are probs going to be very loud too...","neg"
"Busch Gardens with the family! I have a feeling the day will be filled with kiddie rides. JOY! No roller coasters today ","neg"
"Its too early! ","neg"
"@kellypuffs That is sad  What happened to it?","neg"
"@chelsea_playboy doesn't matter! ","neg"
"@kymiess Its gonna be so weird to live somewhere else after 4 years...its really stressful ","neg"
"4 more hours till I'm out of work ","neg"
"so totally bedtime. nn, and shit. want pre. ","neg"
"@sarahdesamours I'mm officially in ur luggage in June!!! Peut pas aider genre!!! LOL.. Opps Damn.. I have Serani coming here... I can't ","neg"
"I really need to update this more. ","neg"
"@MsCrochetS huh what? I'm lost. ","neg"
"uhmm que sueñito, haber que tenemos para hoy..........oh god i really want to sleep again ","neg"
"@DjInfamous804 i know you have... makes people NOT want to be on the phone  but its ok... i just need happy music to get through it lol","neg"
"@alabamawhirly in to my inbox to clear it all out. Now I have to open up my work laptop ","neg"
"@khal awww  may she rest in peace.","neg"
"@jaleesaja: but im not happy... lol. im soooooo confused.!   live.LAUGH.&lt;3.","neg"
"I wish I added the class I wanted to take before it CLOSED &gt;=( This is what I get for lagging  kinda sad nowwwww!","neg"
"Almost out of AAA I hate my job ","neg"
"walked the dog now off to work ","neg"
"@BiancaJWood Yeah but I don't wanna fail my exam from not studying ","neg"
"Had the longest walk home from school EVER! ","neg"
"..however im not seeing that happening ","neg"
"@woodpusher I miss your black &amp; grey stripped long sleeve shirt ","neg"
"@KevinsPlectrum probably hired the equipment for that one night ","neg"
"@peterford We all have our crosses to bear. It's tough being a Saint at the moment ","neg"
"@amyedgeworth lol he let me down ","neg"
"@DannyBoy410 even though u prolly still mad with me bout that 1 time.. it honestly wasnt my fault though ","neg"
"@TomFelton Your hair must be super strong, mine was destroyed after I bleached it! ","neg"
"@paperbat Work, then niece graduation then webinar stuff. Probably no art today  You?","neg"
" @Oneshine What are u referring to?","neg"
"oops.. @sophiepyle OMG &lt;3 the SIMS! i have the same dilemma.. ","neg"
"@Amethyst89 Sorry! I needs the sleep though, got a busy day tomorrow I imagine, Thursdays always are   Had a chance to look at #ficly yet?","neg"
"@matt_lion @Twll give Tungro and myself a shout next time, we're less than an hour down the road ","neg"
"@aplusk I tweet on my iPhone. Wish it had flash player ","neg"
"My bone hurts  i got kicked again! I was goalie today, I wouldnt let the guys score! bwahaha im soo good! but competitive!","neg"
"Just took 14.5 pages of notes.  Brain is fried ","neg"
"I fell asleep instead of making my rad playlist ","neg"
"@Gurlsgurl There's a word for that. Sleep apnea. It sucks, I know first hand. ","neg"
"just walked by marks&amp;spencers food n didn't get her beloved honey n oats flapjack  *poverty sucks*","neg"
"My childhood friend of 26 years - from primary school and the Conservatory of Istanbul was on that Air France plane  Ceren where are u now","neg"
": SYTYCD was not nearly as good tonight as it was last week.  However.. Top Chef Masters was freaking awesome with a Lost themed show!","neg"
"@thesldude86 - and i only just realized it's &quot;LaBeouf - not LeBeouf - oh my ","neg"
"12:15Am... In virginia... More traffic ","neg"
"Trying to study for exams -&gt; failing ","neg"
"Army absolutely trouncing the navy for a change  43 - 0","neg"
"Watching the office. My Weekend is over ","neg"
"i left my mac at my place of work. i bet it's lonely ","neg"
"F.Y.I. IF U DONT HAVE ALLERGIES &amp; U WANT SOME..COME TO VA &amp; U WiLL DEF. CATCH SOME! CUZ I NEVER HAD EM B4  FUUUCK","neg"
"really wanted to go to the bars tonight! ","neg"
"@Cazzdevil Pleased to hear it, where did you go? If it was near here you'd have drowned after you'd been blown away by the gale! ","neg"
"Sitting @home and studing microökonomic/mathe  *nerved*","neg"
"I been sick for a couple of days. Now I feel like I missed out on stuff.  I hate that :/","neg"
"there are at least 2 body-sized lumps on my bed right now. Unfortunately not bodies; rather huge piles of clothes I need to sort through. ","neg"
"bored  / got stoked for hanging out with audra &amp; alyssa, then alyssa bailed, and idek whats going on now. wut.","neg"
"pretty bad night  wishing I was going to the giants game tomorrow to watch timothy....but I'm not :'(","neg"
"wants a zombie survival horror mmorpg for the xbox 360.... sadly  this probably wont happen","neg"
"@cecedesouza sometimes ppl just don't get along ","neg"
"@molskee Really? *sigh* It's hard to believe a mother would kill her child whatever the reason. Therefore, I believe she's mentally ill. ","neg"
