WebEx s management interface needs to be more intuitive  Set up session and can t find login info  ,neg
around the house   cant fall to sleep ,neg
BTW   Who in the eff wakes up at 6 30 a m  on a saturday   Me  ,neg
feeling much better today  Wishing i was back at IoW festival though can you see why       URL,neg
Hsn has the best stuff  Too bad i m broke ,neg
AT_USER Oh really  AT_USER too  So sad  I ve been tweeting them   ,neg
AT_USER Goddammit  I want your job ,neg
Off to deal with some assholes today         ,neg
AT_USER tried to twitter you one  unfortunately didn t work ,neg
MY TWEETS ARENT GOING THROUGH ,neg
AT_USER Noooooooooo  I just clicked that link and deleted my spymaster account I was on level 12 too   Grrrrrrrr,neg
woke up with my mom screaming about how irresponsble I am because I missed my driving lesson tomorrow  I m gonna have to pay fot it ,neg
AT_USER wow Heidi  I ve just read the Guardian apology for your blog  Crazy  We loved it when we read it on Sunday morning  ,neg
AT_USER has the same url   what do you mean by site map  I have done all I know  dont know what to do next ,neg
My camera spoil ,neg
AT_USER Thanks  Now to stop ice cream and sundaes   it s going to be a dry summer lol ,neg
Going home to rental car and  wife  crashed Cooper  I am unhappy  But still in love  Yes  with my wife versus the car    D ,neg
AT_USER nah  I haven t received my stimulus yet ,neg
AT_USER how did you make your pic go green   i have no clue I m using ubuntu,neg
i ve seen so many saab convertibles lately it s making me think of Bette Porter  and how much i miss her and TLW ,neg
AT_USER yea I can tell  ,neg
Really   our floor better get fixed soon  or I litterally don t know what to do other than cry   so far its been a nightmare ,neg
I m going to cry if I can t download  quot T I A quot  ,neg
 you all maka me sad  off to my room to cry,neg
AT_USER at least it s not half one this time ,neg
 quot VGL 5 4 quot  Top quot  closes tonight ,neg
On the phone with my baby  I miss him so much  ,neg
by this time tomorrow morning  i d be at work already ,neg
 not having a good day,neg
Yay just saw a reply that the beautiful AT_USER will be following me  But I didn t receive the email EVERYON FOLLOW HER  ,neg
Going to college for another timepass meeting ,neg
still no iphone cant give up hope yet though  21 left  one has to be mine     squarespace  ,neg
AT_USER Yep  i wish they would say it too  I hate when people make fake trailers for new films  It gets everyone excited ,neg
Good morning  Last day of school  1 2 day   Its gonna be 85   god i hope it won t be humid ,neg
gone fishing  tva lowered the water and the fish aren t biting    ,neg
so very hot n humid in st louis ,neg
I am in Santa Cruz with hannah right now we just came back fromthe beach  We got soooo sandy and we were like really uncomfortable  ,neg
dilemma starts again    sad  empty and confused    ,neg
Bye Jetta  see you soon maybe ,neg
in german classs ,neg
Gonna go study biostatistics now     Got so many things not done yet  ,neg
AT_USER yeah i know that im disappointed bcoz if its being developed 4 consoles it wud be a dumbed down version like fear 2 ,neg
Hate my life sometimes xx,neg
just got outa the bath    starting work at 1 i need the money  all my pay this month is already been spent on concerts ,neg
somehow I went from being respected and important to keeper of screaming toddlers  what went wrong  ,neg
i should be at a party right now ,neg
trying to watch service at GUTS but there s no sound ,neg
CHCH s Randy Steele passes away after battle with throat cancer URL,neg
Apparently  iMovie 09 doesn t deinterlace 1080i interlaced video  whereas iMovie 08 did  URL My workflow increases    ,neg
I m so tired  And i don t want work tomorrow  ,neg
I want ice cream too ,neg
AT_USER That s good  My throat hurts and my voice got worse  ,neg
I can t wait till I finally get internet at home  No more going to Starbucks with my laptop   Yes  I am living in the dark ages ,neg
Just had dinner   My mum burnt the pizza ,neg
AT_USER  quot force  quot  Family is good  Older girls r excited to get out of school The younger one wants to go BACK to see her friends ,neg
Sad It s been a long day ,neg
250 updates  And only 19 followers ,neg
AT_USER why does Joy always look so unhappy on the show  At times very grumpy ,neg
Did some custom work yesterday  Planted 12 7 acres of beans for a friend  Hoped to finish today  but it s raining  ,neg
   another 30 minutes at the bus depot terminal 1 at frankfurt as my bus is leaving at 2 15 pm    f         ,neg
Wish I was in the city right now ,neg
AT_USER Yeah I know  I miss Trevor Lock aswell  No idea what he s doing now x,neg
it s so disappointing when your friend backs out last minute  not inviting him ever again  ,neg
AT_USER Why did you guys pull out of the Spoon show       ,neg
seeing the gf for the first time in a while  water balloon assasin war is going well  althgouh i lost AT_USER and AT_USER ,neg
AT_USER Can t believe I missed first question  amp  it was a Sondheim one ,neg
today was too long  the weekend went too fast  and im too annoyed about stuff to twitter anything half decent   gonna get me a cup a tea ,neg
AT_USER that sucks ,neg
AT_USER lol I m not up on that yet     And why didn t u  that sucks,neg
AT_USER yeah i see nothing but a hint of the pic  thats how it is with everyones on my screen   maybe its just me ,neg
AT_USER i love yooooou  and i am excited to work out  i think  hahahaha ,neg
AT_USER Me miss you  ,neg
AT_USER RENO   I go away for a few days and this is where you end up  ,neg
AT_USER then we are screwed cause girls have always dated older guys  now asses  then contaminate the sweet ones  vicious cycle ,neg
AT_USER AND I DEF saw u at the outlets on SAT now that I think about ti  sorry for not speaking ,neg
AT_USER     three new three in a week is not good though  Two would have done another month  the other another year ,neg
AT_USER ME TOO  The corncakes were my favorite ,neg
AT_USER yep  it was definately over the line   missed out on Susan Boyle to win that evening though so luck ran out later on in the day ,neg
AT_USER not really ,neg
starting summer class next week ugh not excited ,neg
My camera broke  ,neg
Ugh  spam accounts are still on this site I wish they would just go away ,neg
 boredom There is nothing quite like boredom  It sinks in and mocks you with every second that ticks on the clock ,neg
My ear hurts but if my last baby would go to sleep that would be grand ,neg
URL   My brother whipped me with a dish towel ,neg
AT_USER Oh no  I hope you feel better soon  ,neg
Time to shower  amp  head out to work lol,neg
My flower from the green night is wilting ,neg
AT_USER no we at BJs,neg
looks like vegas in august is a no go since my aunt beat me to a vacation that month ,neg
damn    drop by 1 26  alexasalsabila com,neg
AT_USER Are you fine w  me   ,neg
AT_USER AT_USER thank you for the shows thank you very much for everything and for all time here in Brazil  It was amazing Good bye ,neg
can t believe I bought a pocketwatch today   now off to the trains to go back to essex and edit essays all night I don t wanna leave,neg
 This year it won t have arena football games  Nooo  Shit  But  everybody knows that this year Philadelphia Soul would be champions again ,neg
is waitin ughhhh,neg
this freaking heat in the city is driving me crazy   s     Im so tired and im not even on my way home  ,neg
Feeling saddened  Its almost like Ive lost a limb when my parents took away my phone X,neg
Writing a blog about bing com  but the site is really slow ,neg
oh and i hate that guys are misleading  like seriously  stop flirting with me just to tell me later all about her  really   thanks taps ,neg
AT_USER thats why  i know formal punjabi only  in the beginning i could only read n not speak  the fruits of living in a city ,neg
AT_USER I am not better yet I think I will be OK tomorrow  Not great    but OK,neg
How much is GrabUp Pro  Their site s being all dirty and not working so I can t check xo,neg
im sad today i was gonna go to da pool but it started raining so i couldnt go ,neg
I Still Cant Get Used To This Twitter ,neg
AT_USER oh man  can I come to    I want to plan  ,neg
still gets 6 hours of sleep even when I have all the time in the world to sleep in  ,neg
AT_USER 3 hours and still waiting for a room  ,neg
misses all my friends hopefully ill be able to see them tonight ,neg
Playing FlightControl before a flight a good idea for a nervous flyer  Erm no ,neg
AT_USER dude I m scared  its already happening  people I know  ahhhhh ,neg
Where is the boss    I d like to have my check and leave please  ,neg
AT_USER Probably because I told to them to hold my app process til Bodie was well again Thats what I get  right   geesh ,neg
my nose  it is stuffed  ,neg
I think if I could go home now  I d go and pass out  So achy and tired today  ,neg
I have finally unwound from work and I m going to sleep    just to get up in a few hours      ,neg
I have an aching back  ,neg
AT_USER too sad that i missed ur show ,neg
Emily made me laugh when I was drinking gatorade   not cool x x ughh my throat hurts sooo bad ,neg
has nothingggg to dooo  wishh i could be with the Ruptorss and theyy didnt even bother to tell me of the BBQ   O ruuuuuuude  neverMind,neg
found a stray dog on the road last night   quot Barney quot  was the cutest little thing ever  He had white dreadlocks  Wish I could keep him ,neg
URL this is crazy i think he had a problem ,neg
I m so pissed off right now I  m being made to go and spend a month in Pittsburgh WTF I had a plan to just stay for 1 week  ,neg
AT_USER awww sorry ,neg
AT_USER i know il be in LA next month maybe you can help me with the spam and kneepads ,neg
yet another morning when i awake with hunger  and no food ,neg
 Legs got to much sun they are killing me URL,neg
Summer solstice  Really  It s not sunny enough ,neg
I know  Its such a nice day  And I have nothing fun to do but lots of unfun things to do     ,neg
AT_USER I am working on getting certified as a Tahiti Tourism Specialist  so I get good deals all the time  but not free    ,neg
AT_USER he is def  gonna regret that comment in teh morning ,neg
trying to look for some good soccer studs  i dont even know the F of Football ,neg
So bored  and the sun rays make me sleepy ,neg
I tryed to get me a iPhone                      did nt work grrrrrrrrrrrrrrr ,neg
I feel bad Will make up for it in the week with a  quot jonscatchupfollowmonday quot  ,neg
gah i feel like crap  S don t come please cold don t come ,neg
I miss AT_USER AT_USER and AT_USER Love you guys ,neg
AT_USER What   Tomorrow   Bummer  ,neg
graduation is in 3 hours and then grad night    they aren t telling us where it s at until we GET there  and no phones allowed  ,neg
Need to study a bit today ,neg
camera broke during lil sis  grad  took FILs  camera to cabo and ended up shooting all pics in multiburst mode  ,neg
AT_USER NORWAY  i liked sweden ,neg
AT_USER I had a dream that I was trapped inside Mr Pope s epic beard  Ok  so I m lying ,neg
AT_USER got scammed on the web and now I m trying to get my money back  ,neg
raining ,neg
Played Texas Hold  Em Poker tonight  I was winning at first but somehow it turned around ,neg
AT_USER I just also read that people are saying you deserved it  Awful  awful  That is just horrible  Feel better hun  xo xo,neg
AT_USER AT_USER won t even let me have a guinea pig  so a pony is out of the question ,neg
i am so bummed about the lakers winning really wanted Lebron 2 win it  but i guess you need more than one decent player on a team,neg
AT_USER How do I update my twitter by text    I text to 40404 right  Cuz I did that and it wont work    ,neg
I still hope warne plays some good shots and make the team win   And he goes off as i type this ,neg
Going to Ash s bday party     but feeling a bit sick ,neg
Worlds Worst Headache ,neg
At maries  I havent done my hair in forever  Someone bring me a drink yo  Im thirsty  ,neg
is still awake due to the fact that i am unable to fall asleep until the late hours of the nite    ,neg
today is such a perfect day to hit the beach  and i have no one to go with ,neg
I am not looking forward to getting on this tiny plane    all the way to memphis   bummer ,neg
AT_USER im working too     E to super zuadinha  ,neg
Tomorrow I will be 30  goodbye 20 s ,neg
AT_USER I should have listened Now I m scared if I go to bed they one eyed gypsy will get me  FFS I m 19  what is wrong with me ,neg
oh no   I don t want fever now too  ,neg
just sitting in the house watching two and a half men and listening to music at the same time   sundays are so boring ,neg
AT_USER I know  I know  ,neg
AT_USER AT_USER miss you ,neg
tired      exams to study forr     ,neg
AT_USER URL   This is NOT good  ,neg
On the internett x and msn    hmwk tooo ,neg
no more wzor ,neg
my lip ring fell out while i was sleeping and i didnt notice it till now and it hurt really bad putting it back in cuz it healed a little ,neg
Good Morning Off to work ,neg
headed to the gym  toning and running day  my LEAST favorite ,neg
AT_USER we shoulda kept the streak of hanging out going and went out 2nite ,neg
AT_USER Poor beagle with the cone  ,neg
is doing boring accounts stuff ,neg
A lil Fed Up tbh ,neg
AT_USER not in mine  ours   lol  it isn t  ,neg
ok this film is seriously freaking me out  Someone come change the channel for me ,neg
AT_USER she only passed away about an hour ago so you re not too much out the loop  its tragic  ,neg
AT_USER Wow  somebody has a very exciting next few months  I would like Lasik  but visual artist   my eyes   suicide Good luck  ,neg
AT_USER o o i HOPE SHE GETS BETTER ,neg
Stuck at home sick today    and yes  it sucks ,neg
No classes again  I miss my friends ,neg
Im hot too ,neg
bed  my tummy hurts real bad  ,neg
Eating at spicy pickle with AT_USER Online session went awful  ,neg
AT_USER Totally feeling your pain right now   TOS  deserved best book   tonys,neg
Better make a scarecrow  Those crows are destroying our garden  No more corn plants  ,neg
Oh  I m so borin    why not play the computer   My mom s say  because your makin  task     ,neg
skipped meals  My first decent meal  muffin at 4pm  URL,neg
AT_USER I know  Fudges  I want them to come here too but that s too much to ask  I wanna meet The Rock and Stone Cold  Period  ,neg
Sunburn  absolute agony ,neg
AT_USER stop being mean to me   ur hurting my feelings ,neg
i wish i could be more useful or helpful which is a pretty big wish considering my current predicament  ,neg
AT_USER Apparently  the internet won t let me watch it until 10 45 and I can t stay awake that long ,neg
i want the song   show me love but can t find it nowhere ,neg
andrew come home  ,neg
that s a fake ,neg
I suck  Many Fashion Week invites but didn t go to at least one Next season i swear,neg
i dont want to leave ,neg
I m scared that the Blink182 concert will sell out before I buy tickets Been a fan for 10 years  Never had the chance to see them live ,neg
AT_USER i guess my boys aren t playin baseball this week ,neg
grr at having problems setting up my website to host wordpress ,neg
AT_USER i was up talkn to my friend abt my lifes plan  amp  decided going back to bmore is not lookn 2 promising ,neg
AT_USER aww I think working on our entries made you sick   ,neg
I HAVENT BEEN ON THIS IN AGES  i forgot my password ,neg
no one ever replies to my questions on here  or comments on my pictures ,neg
AT_USER AwURL I should have warned you all that I d be disgustingly chipper and okay today  I just got back from my walk ,neg
AT_USER I set up Marcello s Twitter acct when I was last in NYC  AT_USER but he hasn t used it  I need to bug him about it ,neg
On hold with unemployment  hoping to get call completed before I need to get daughter from school  Not looking good ,neg
Cleaning up huge soap spill  v ,neg
but it affects you ,neg
sick at work but leaving early I think   fucking summer colds ,neg
AT_USER but I reallyyyy don t wanna    I wanna go bak to sleep ,neg
sick ugh why why why why this blows I feel horrible ,neg
I come to Boston and the Red Sox lose  ,neg
AT_USER Noooo thats just AT_USER AT_USER and AT_USER Mine is Monday    although I have 2 that day ,neg
Im lonely ,neg
At work even tho I need the money still rather be sleeping in  Being an adult sucks  also I am scared to lose the one thing I need be    ,neg
BlackBerry  3 bites the dust ,neg
Bombed today at the tourney but i got all the pieces to Swans ,neg
is SLEEPY     Ready to go home and crawl in my nice warm bed  ,neg
I had my nephew all day and now he is gone and I miss him even though he was grumpy all day,neg
AT_USER I haven t been to one in a minute  Felt like a family reunion,neg
oh gosh needles suck    ,neg
that wa the worst exam    i could only really able 2 do 1 question propally ,neg
AT_USER because noone takes them   SCTUB,neg
its raining again ,neg
Anywhoo  short but sweet Twitter sessions tonight  Back to Chester tomorrow  Another long coach trip Night all,neg
I ate only organic  whole foods the entire day today   which is really quite an accomplishment  But still feeling massively overloaded  ,neg
Shit  I m kriss kross   i missed the bus schijt Arriva   On my way 2 mah J O B  Zo geen zin   ,neg
Must go to the train station Fun times  x,neg
URL   and my best friend is married   tear tear,neg
Hungry   and someone is so late ,neg
Boss has a breakfast tab running with me I think she s forgoten about ,neg
AT_USER school etc  you know  meant to invite you to blues explosion on wed but forgot have a safe trip ,neg
nothing in the mail today    ,neg
AT_USER I just just had to download  quot Everywhere quot  from iTunes since I can t find my Spirit Room CD ,neg
AT_USER thanks for telling me   maybe I m copying the links wrong when making short links The rest of the vids come from the same site,neg
AT_USER Alright  fair enough  sweetie    ,neg
AT_USER aww i really wanted to go ,neg
so  so sad     URL R I P Colby Curtin ,neg
AT_USER I KNOW RIGHT   I regret not having said anything because my mom bought it for me  But I just know she would have started summin ,neg
no mood to study              sob sob,neg
not happy with twitter s decision to remove   replies from people I don t follow  Messes up my whole random followfriday gig I got going  ,neg
AT_USER Augh yes I want candy ,neg
AT_USER Anthony  I had to cancel due to selling our house and dealing with closing issues this week  ,neg
Missed church and spent over almost 2 hours on the phone removing a virus from a kiosk computer   molodezh live  gt  URL,neg
3rd place isn t good enough in texas hold em  ,neg
 goodmorning  up early today  training ,neg
AT_USER LOL  Lucky you    I don t know why I can t sleep I have to be up at like 8 I m gonna be so tired ,neg
Stood front for support acts  Julian GCC loved us  Had GCC banner  lt 3 Had one for Emma but was taken off us ,neg
Back from church camp hours ago    And I just woke up from my supposedly afternoon nap  there goes dinner ,neg
AT_USER I saw your texts  I just didn t have enough battery life to respond ,neg
AT_USER With who     why didnt you call me     ,neg
AT_USER p s  yes i made it just in time  haha i was gonna twat you yesterday but the server was busy i had to resort to fb ,neg
AT_USER ME ME oh wait i cant wat if i unfollow then follow again  lol,neg
Going back to work  Hopefully not getting fired ,neg
Going back to sleep      headache dot com ,neg
that steak tasted like  nothing  ,neg
AT_USER i m praying for you  Sorry to hear about your bro  man ,neg
is slowly figure it out twitter and ENG paper sucks URL,neg
AT_USER I can t get your tweets What s the big problem here  Is it twitter or is it me ,neg
And secondly  I have won second prize  as in  first prize   one more week off work  second prize   TWO more weeks off work ,neg
Wont last another hour without power ,neg
really wanted to like the Cobalt if for no reason other than the price but cannot and does not   fb,neg
my ipod s running out of space  ,neg
AT_USER lol    wutever   u don t hit me up nemore ,neg
AT_USER worcester   beautiful weather   Shame I m seeing it through tinted office glass URL,neg
yay the weekend is here   but workin on sunday but its with em so im happy ,neg
says first week of teaching    suspended and classes URL,neg
going to the orthodontist today ugh    my baby comes home on saterday     i can t wait   ,neg
AT_USER Hello well it s friday afternoon now and it has not rained today  however the clouds are rolling back in and rain all weekend ,neg
It s 3 in the morning and school s in less than 4 hours  Why am I still up at this hour  Researching for a fucking General Paper essay  ,neg
I miss you my BlackBerry ,neg
Is watching Maury   shit  I am the father ,neg
AT_USER I don t live in Hawaii infact I have never been ,neg
AT_USER Damn  I won t be able to listen ,neg
Ugh    Stuck watching letterman instead of leno bcuz of stupid digital tv  Nbc isn t coming in tonight  ,neg
feels lost with morning routine without Phineas and Ferb and Cheerios ,neg
Jesus  she can be about as encouraging as a stroke  I just want her to be happy  but yikes  ,neg
so sad  my aero spree is cancelled ,neg
Rolled ever to chk my email on phone  Still no Internet in new bldg     Plan on doin some wrk  amp  s beach today,neg
Getting braces next year But  my mom is getting this  30 000 dollars braces  There not like the metal one  There some special kind   ,neg
AT_USER Yeah  it s a bit out of my price range too unfortunately ,neg
Watching Super Junior Specail stage at SBS Inkigayo  Really awesomeeeeeeeee  I cant belive that I cant see them anymore waiting   ,neg
I hate my life I need to sleep  catch up on as many downloads as possible then go out  Imagine if I actually had a job or something  xD,neg
End of the night for me  work tomorrow  and no free jeans  Sigh  ,neg
AT_USER whats that   ,neg
just woke up  after sleeping for 12 hours  i missed the jonas brothers on jimmy kimmel  i fell asleep ,neg
AT_USER change of plans  He is working today  ,neg
glutened for the first time in a while  and it was a bad one ,neg
im sad  won t go to brits concert in london ,neg
is at home at a Saturday night   sigh  URL,neg
back to work tomorrow and the annoying girl who works next to me if you notice any weird tweets tomorrow they re from her haha,neg
my finger feels like i broke it ,neg
Phones dead ,neg
AT_USER yay  i missed you and in a few days you re gunna leave for 2 weeks    ,neg
AT_USER nope   claire tried to do it for me   so i ended up sitting on my hands ,neg
AT_USER Sworry I was curious  One had a massive clit teeny cock byt the other had a normal willy with a fanny under it  Crazy,neg
feels sad last 2 weeks na ng Hot Shot  tears  URL,neg
Damn there s a lot of spam on twitter    I get all excited to see a new follower    and it s some horny bitch wanting my credit card    ,neg
AT_USER I would looove to go with you  I really do  Just don t know how I m gonna get there  No one s gonna take me  LMAOOO ,neg
hum sometimes people are unfair ,neg
AT_USER Wait  why was  quot Casserole quot  a repeat tonight   ,neg
WHERE HAS THE SEXY HOT SUN GONE     ,neg
grr why is socializing so hard for me   ,neg
I am sitting in bed watching  quot It s Tougher in Alaska quot  on History Channel  Girlfriend is sleeping  and I am typing away on some projects  ,neg
At boomers  Chuchi burnt his lips ,neg
Just got news someone tried to murder my uncle in kenya shot three time  in hospital  lost a kidney    so scary,neg
This game is too close    Cmon Orlando MAYNE   ,neg
AT_USER I m too pissed at the BNP getting a seat to sleep  Racism makes me sad Naked ladies makes me happy  At best I m neutral tonight ,neg
AT_USER i miss you i hope to talk to you soon ,neg
I guess I have been twitterific enough this last week  I lost a few  followers  bummer  ,neg
AT_USER aww mee tooo    ,neg
Crazy bored   no car   stuck at home   Jeff is putting a floor in a rental  should have been done this AM  but helped Big Sexy instead  ,neg
AT_USER me either  Sucks ,neg
Aw  I just stepped on my dog ,neg
i dont knowww ,neg
AT_USER lol  wait add who   S Sorry I got confused  And Good luck with your exams     My exams don t start  till after 2 weeks  ,neg
got cancelled  it is raining outside ,neg
AT_USER have fun laura I wish I could come but my id won t work I need a new one ,neg
i really don t want to work at the pool tomorrow ,neg
wow  so glad i stayed up late last night my day home till friday stupid camp ,neg
AT_USER OMG     Get out here    Whos coming in July ,neg
Back home now  relaxing  Been out shopping  Spent too much money though     ,neg
AT_USER Looks like Facebook removed that URL awww ,neg
Good morning  getting ready for a day back at school ,neg
Exams are ooooover  HOORAY  But can t go out and celebrate courtesy of searing sunburn pain ,neg
AT_USER AT_USER I miss u guys    ,neg
Haha i bet a man did make heels  Im sorry you hurt though  I hope you feel better   Livelovesing ,neg
i knew qld had it in them  but poor jarryd  he looked so sad  lost my voice for him ,neg
Leaving the beach now got some nice pictures but sadly wasn t inspired enough to draw anything ,neg
Ugh I just ripped back both toe up socks I have been learning to knit too big and floppy  Starting over cuz I just had coffee  at 12am ,neg
AT_USER I wish you could get down to Manchester  or I could come up to London to try and find you I m GaGa over GaGa  Can t wait forPOG,neg
so faaar summmmer SUCKS    i wannna do somethiing fuun alreadddy  amp  i got tha worst news last night ,neg
Google Voice seems to be down at the moment  ,neg
I have a massive tummy ache ,neg
