More surgery for mom on Thurs   squarespace,neg
nothing to do on a friday night ,neg
AT_USER thank you for posting those links  I was really wondering what it was like  Too bad I couldn t be there ,neg
 rings seb and no one answers ,neg
In the doghouse ,neg
Was doing well with the recovery from my surgery  But after the shower I took the pain is bad  ,neg
Freakin tired   not cool ,neg
I had an amazing time at the videoshoot with Demi and Miley today  To bad I can t stay with them forever ,neg
Ughh  it s too early  ,neg
URL   a little message to best friends that are apart  i miss my best friend ,neg
I can t believe i m probably not going to see britney 9am exam may have to win    how do i tell emma    URL,neg
Exaaaaaaaams    i have Physics Exam 2morrow    ,neg
Got stood up by Jean Paul Makhlouff    chillin with the bestfriend lt 3,neg
AT_USER Aww You can borrow mine  Lynn ,neg
1 week without coffee  Want to try drinking it again  still afraid of barfiness happening if I do  Stupid medicine  ,neg
AT_USER OMG  THAT SO FAR AWAY   O  I live in London ,neg
Just did a JB on my iPhone 3G 3 0 using redsn0w  Worked like a charm Too sad people don t realize that the 2 1 ipsw is for 3GS phones ,neg
My plant survived  but its flower did not  ,neg
Ugh    Getting wore out    and feeling low    thinking about bills ,neg
woke up to find this cold flu illness type thing isn t going without a fight and  apparently  beats you up in your sleep  Sorry  keynote ,neg
awesome   above average temp today in good old Phoenix  Not ready for the heat  ,neg
AT_USER Aw  and I was about to tune in  was too busy watching your clip  ,neg
o stress    i dnt wanna be a cheater ,neg
AT_USER I m about to have one now  just made a grasshopper pie but can t try it till it chills overnight boohoo ,neg
I am so sad right now  AT_USER just left and the house just feels so empty  I ll miss u roomie ,neg
I don t want to go back to school tomorrow  I didn t do my homework LOL  I m gonna be in soooo much trouble  The assignment is worth 25  ,neg
AT_USER haha  im not that bothered   im just bored haha  i feel sick ,neg
AT_USER I m just bitter than I m not in LA  ,neg
AT_USER I m barely walking since my April accident  had to cancel the coaching   m a mess ,neg
Summer classes    start tomorrow ,neg
 l I m finally able 2 get on here while on lunch  amp  every1 disapears but when I m not on lunch every1 shows up  What up w that    ,neg
AT_USER I didn t want to leave but had no choice  I can t do two internships  a part time job  and take care of a sick puppy  ,neg
have tried half an onion  warm oil  pain meds and nothing is helping my little girls sore ear any hooky kooky ideas out there  ,neg
My bappi might die ,neg
done shiit in my mentle maths test ,neg
So  fucking tired  why am i always tired these days     i had MATHS  all fucking day      i missed drama amp DT ,neg
Shit  H amp H Bagels in NY has shut down  Sad loss Someone tell Kramer,neg
poker night instead of kate voegele     i guess it ll do     ,neg
is going to dreamland and hopes to see AT_USER there too misses him badly   ,neg
AT_USER jealouss  i just bought a blackberry bold n i think im regretting coz it turns out the curve 8900 is better  noooo,neg
AT_USER Yep  It s still corporate standard here ,neg
PBA UPDATE FINAL SCORE ALASKA 76 GINEBRA 75 ,neg
Yep  Twitter is boring too  I wish I was hanging out with Billy    ,neg
AT_USER Golf is fall season   Aren t you doing volleyball though  It s not too late to join    We need girls to join  ,neg
Really really really need a new phone can now upgrade anyone recommend anything  Can t get iphone cos o2 not good reception ,neg
AT_USER totally horriable she remimds me of my mom hardcore,neg
AT_USER dude what the heck   it s my bday too   T T pamela didn t even know until i told her ,neg
My wonderful napping plan has just been scrubbed  Have to go shopping for stuff for my BIG trip  I know right shopping YAY but I m tired ,neg
Not having the best week    ,neg
AT_USER i want to be there     but we didn t have someone to ride us there  ,neg
AT_USER two sleeps for me working Saturdays generally sucks  Mates 21st Saturday night tho ,neg
URL   awhhh i want another baby ,neg
Serious headache today ,neg
AT_USER AT_USER It s because there was such a long period of time  7 months  between permanent employment jobs due to redundancy ,neg
Saturday we have a 3and a half   some travel to Nottingham i get travel sickness and amys dad isn t usin a satnav mite have to leave    ,neg
had to wake up at 5 am today had to go to airport         ,neg
AT_USER thats so cool  why didnt anyone come suprize me at my prom ,neg
Getting ready for work  I d rather be seeing Camila ,neg
I wish my neighborhood was safe so I could go running at night  ,neg
AT_USER Sorry  but you don t do anything for me Jimmy ,neg
AT_USER You re one cruel bitch ,neg
Maximus thinks work sucks when you re by yourself  with only menstrual cramps and sore tonsils for company  ,neg
its dreary outside ,neg
AT_USER arrrrg it must be bad mcdonald   burger king always hire,neg
AT_USER whether you take my offer not  Hate seeing people all down and shit  That s lame ,neg
AT_USER no answer yet ,neg
Kiss me      I am not shitfaced     Already  ,neg
i must have been bitten by some mosquitoes  My arm looks like it was attacked by them  ,neg
AT_USER very true    but i still managed to wake up  even before i needed to i should still be sleeping   ,neg
AT_USER oh no  not a swimless day ,neg
My heart hurts  Think I hurt the most important man in my life tonight  I hope not cause I love him dearly  ,neg
Arrived over an hour early   no bags  Had to sprint to the gate as the doors closed since United check in system glitches me  United ,neg
Wishing he would try hated so I can be with him again ,neg
Going to watch a film  night xoxo ,neg
Bad night   sore bottom and arm   no fun ,neg
 nip tuck has been cancelled ,neg
why the feck am i still up   ,neg
My mac just had its first system crash ,neg
Where have all the nice people gone  ,neg
AT_USER COMING TO DC BABY    July 17th     its been too long ,neg
AT_USER haha  damn work for stopping my jeff lewis love ,neg
AT_USER I tried calling you   didn t work ,neg
Well  after spending a few hours trying to get this webcam to work with Windows 7  i now have a completely dead webcam  no more streaming ,neg
Doing the assignment for Steve Marshall s class    CV cover letters not fun writing ,neg
i wish it would stop raining its i have to walk in it soon ,neg
Laying on the couch  not wanting to go to work ,neg
healthhhh ,neg
wants someone to help her write music point me in the right direction   ,neg
Really need to sort out my body clock   especially as I have to get up at 7 on saturday    ,neg
AT_USER awww i wish you were going tooo but your still gonna have an awesome high school with annie   ,neg
AT_USER oh man  Well I got the impression it was ,neg
AT_USER I just asked him again and he said I would have 2 get a job so I can buy the new iPhone  That s not gonna happen anytime soon  ,neg
Really wanna watch Apprentice  amp  BB but am soooooooooo tireddddddd  Don t think I m gonna make it ,neg
Nikki doesn t know how to share  ,neg
AT_USER C mon Blue Tongues  You can do eet  Sorry Pete haha,neg
Wishing things would start getting better for those i love    Boo for perpetually shitty months ,neg
Idk how I m going to fall back asleep    ,neg
AT_USER i miss you naima  i m taking classes too ,neg
have a huge headache  amp  sore throat today and i can t believe this shitty weather  why does it have to rain ,neg
is going to pick up the BUILD members from the hotel  Last night in Guate for them ,neg
Ffffuuuu the dress i wanted to buy is sold out ,neg
On a verge of a breakdow because os all this raiiiiin      ,neg
AT_USER hey    are yous back in the uk yet   we miss you ,neg
Seein my bestie for da last time  Shes leavin me for 2 1 2 months  ,neg
URL   I miss my roommie  We went out for drinks yesterday ,neg
I m kinda hurt that AT_USER didn t answer my tweet yesterday  Weider Powerbell   yes  no  maybe ,neg
AT_USER i hope you will read my message before going to mall ,neg
AT_USER I think the answer is no  I ran all the steps  but no Internet Tethering appears in the Network menu ,neg
chick fil a for dinner  Hopefully I feel better  My head and eyes are killing me ,neg
arggghhhh     exams start on tuesdayyyyy      ,neg
I so wish I hadn t this morning ,neg
is working the weekend away ,neg
Love the sunshine  really lifts the spirit  but it makes the laptop very hard to see when sat in the garden so I m stuck indoors ,neg
AT_USER Not in my blogging world  We support each other  and we re nice and kick ass even if we don t agree  No time for that shit ,neg
mmmm okayy whatever  you dont tell me whats up with ya anymore ,neg
Ahmad is being mean  ,neg
Back to back meeting fail ,neg
the chilling temperature in my room is making it impossible to fall asleep ,neg
on my way back from Birmingham now  what a messy messy weekend  battery on my phones dead so wont be able to tweet ,neg
AT_USER I guess we shall see       ugh I hate this,neg
Say it ain t So sa     ,neg
bored like fuck home alone on a saterdaynight ,neg
AT_USER My sister and I are suppose to be meeting you today in Birmingham  Please reschedule   ,neg
had a very long weekend  still feeling tired and stressed  Lambing naman dyan  ,neg
i wanna study but i can t really tired ,neg
Back To Work I Go    Seriously Need Sum Breakfast First ,neg
Have anybody a link from the GLAAD Media Award yesterday  where I can see a video  It isn t on youtube ,neg
jeez  nothing gonna do so bored ,neg
Is anyone out there  Of course not    it s 4 07am  I have to go to work early tomorrow and I can t sleep ,neg
the tips don t seem to help though   firefox s still hogging the CPU ,neg
is sad  Fam left today  from their visit   amp  the house seems a bit too quiet  URL,neg
AT_USER if i got rid of you they d arrest me unless i make it look like an accident ,neg
windy day in pattaya thailand    today i am feeling bad  eat something worng yesterday   couldnt go to a show in the morning   ,neg
Privileged has been cancelled I ll miss my Will  amp  Megan   they should ve had them get back together in the finale ,neg
Doesn t want to work its been a longggg week ,neg
Twisted my ankle ,neg
I dunno if I was wrong or right but I guess I m wrong    ,neg
AT_USER aha right you are  My bad I was actually working with php 5 2 x and posted the wrong thing entirely ,neg
Our poor cats are so scared ,neg
AT_USER conditioner is much less soapy so you need to use MUCH more of it which is a pain ,neg
Just woke up with the sharpest pain in my chest ugh,neg
moming and packing ,neg
Hoping Abby stops limping  Poor thing plays to hard and pays for it for days after ,neg
AT_USER I lost your text number Can I s have it back  ,neg
AT_USER sadly  no  we had no way to get to rowan and we couldn t get newburgh tickets we were really pissed about that  lol ,neg
No smile policy ain t no laughing matter URL,neg
AT_USER lucky u  i still got 2 exams to do     ,neg
AT_USER yes  tooearly agree,neg
 pouting and stomping my feet  KEKA  tell her to stop rainingor im a F her uuuup      AT_USER,neg
on my way to get surgery   joyy  im hungry ,neg
I lost a follower ,neg
AT_USER only seen the film  really really good but yeah  pretty sad ,neg
I missed the math trade ,neg
AT_USER I knowwwww  grr   Ill work on it 2night  Honest  lol,neg
AT_USER why what happened   saw you are out for this year   a shame ,neg
URL If only ,neg
AT_USER not yet  But I m sure they won t make it thru the weekend  I ve been cleaning for hours  amp  it feels like I m only halfway  ,neg
AT_USER that freakin  sucks      sorry  ,neg
say anything unless it was all suppose to be in sub text but it stunk  hope the other news you have today is better  don t disappoint Ted ,neg
AT_USER really   i didn t get it  ,neg
I don t think this  quot Horny Kitty quot  is a person  I don t think it s a cat either  Block one  get two  and so on      ,neg
ajd   wish I were there  Get on that ride for me tho   lol  you know that s my jump off  ,neg
AT_USER I m not even working  I m trying to fix my picture  it s too big  My head looks ginormous ,neg
Oh my lord  I haven t been to the gym in 4 days and I know have to pay for it ,neg
Slept when I got home     still tired  I thinkin I m coming down with a cold     I hate being sick in the summer,neg
Cleveland     ,neg
Home from work  Only saw my brother for a moment today  ,neg
AT_USER omg  no way  has it started doing that now   ,neg
Well i thought me and him would date but i guess not cause he hasn t text me in 4 days now  ,neg
this essay is laggy as hell i need to write another 500 things and running out of things to say and still got bibliography to do ,neg
  work early as hell  so tired of bein here dis early ,neg
I don t want to start work tomorrow ,neg
I m having a really hard time falling asleep knowing Emily s not in her bed ,neg
AT_USER URL   why is it a broken heart ,neg
elle s just been for a couple of hours  then jades mum came and got a kitten  cant believe my babys gone haha   got my twins left tho ,neg
got the weather station mounted on my jeep  severe weather  you can come now  except i really want to swing dance tonight ,neg
 I need desprate help  Tireddd and now gotta do blooming ICT  ,neg
Awww won t get 2 see AT_USER live   mm 2day wasnt that rockin ,neg
First day of mid exams  Wish me luck    ,neg
Good Morning Tweeters   Had A Great Sleep But Some how I Wish It Was Later ,neg
ahhh so bored cant wait till Saturday,neg
boredd like one of my friends  friends     P was gonna go to TAKING BACK SUNDAY concert but didnt      lt 3 ,neg
Party   Hahah  My sis wont shut up ,neg
I gotta do it     RUN away from work and live in the Jungle wearing nothing     only thing is no Jungle in Maldives    ,neg
Terrible headache ,neg
Or as often  That s what I m feeling n its kinda sad  feeling sick about it all ,neg
heartburn  amp  depression ,neg
Starting my day listening to Tape 101 webcast So wish I was at the Social Media Marketing Summit in NY  it seems far more interesting,neg
 haveyouever wish you could get into someone s head to change it  amp  make this person better  ,neg
AT_USER AT_USER AT_USER AT_USER On second thought  never mind  There are now jap starters  AURL ,neg
AT_USER Well  I know it ll certainly be a USA Today Best Seller  LOL    You re awesome ,neg
i am soooo sick of being sick all the time     ,neg
AT_USER and one iphone is dead ,neg
AT_USER Been there  done that ,neg
We ve passed by like three of my favorite restaurants    But alas    They only take cash    And I have NO cash ,neg
In English have cramps ,neg
I want to be with him  NOW    I missssssssssssssssss him soooooooooooooo much ,neg
My bookshelf just broke and woke me up  Apparently I own too many books ,neg
Just play 1vs100 on xbox live for the first time  I think my wife did better than i did ,neg
AT_USER So gutted i cant make the gig tonight Damn uni exam in the morning grrr ,neg
really needs to find myself a new job  This day sucks so far  ,neg
aw how sad  URL,neg
AT_USER I ve sobered up ,neg
never uses twitter  ,neg
1st day of summer break  and its rainy outside ,neg
is awake too early and longs for her uni lie ins ,neg
i very hungry eh  ,neg
AT_USER Yeah  I have an alcohol problem    I m getting better though    ,neg
Game was postponed  bummer ,neg
AT_USER I feel that sir  I feel that ,neg
is just about to go to college  it s far too early    ,neg
AT_USER You bet  Since my parents arrived and I took some days off from work  I ve been more tired than ever  The yard awaits ,neg
I need chocolate ,neg
Perfect cuddle weather and nobody to cuddle with ,neg
Boring   doing nothing          ,neg
Suuuuper tired   Corges house and I think me and tayla r the lasts  Ones awake,neg
All my colleagues have deserted me ,neg
There is nothing better than going to bed annoyed  ,neg
Sorry I ever supported HP   HP has turned into Gateway and emachine   crappy  ,neg
left her ipod and home keys at the office  That s two out of three things she just has to have with her all the time  ,neg
ughhh  twitter   my phone   not friends ,neg
Kind of bored on a friday night ,neg
Why does my nose keep plugging up  I don t have a cold  had dream my mom was preg  amp  going into labor  amp  her husband didn t know wtf to do ,neg
it just a piece of cream   thrs no cake ,neg
URL aaa    perfect song  capoeira  black and white    2 bad you re dead for me    ,neg
Doen atletics 2day  so warm ,neg
I ve got the Sims 3  But I can t play it because I dropped the booklet down the side of the fridge  I have to wait til my dad comes home  ,neg
AT_USER i know  work work   he he  lucky guy ,neg
last day at home for a minute  sadness  ,neg
AT_USER in cambridge and not tellin me ,neg
Hittin the hay     doctors 2 morrow    shots    boooo ,neg
AT_USER awww i know    tomorrow though its on babygurlz   ,neg
AT_USER but i like reading the bullshit  ,neg
i have a frekin ear ache nd its annoyin    ,neg
May not get to go to the beach  ,neg
My gas light went on aahhhh,neg
Oh well   we re off to a company picnic  In the thunderstorms  Why the organizers didn t cancel I don t know  but Sharon HAS to go  ,neg
I am now halfway to 46 ,neg
AT_USER i m laughing so hard   i m gonna pee in my pants  jealous   i want to go to the conference ,neg
AT_USER it sounds like you are having a hell of a time wherever you are   sorry friend ,neg
Damn I m sorry I said ebay now I got all these weak sauce ass bots following me  ,neg
AT_USER aww becky  this made me instantly sad  I feel like I just watched a compassion ad about those less fortunate ,neg
I can t believe I managed to break my Bose Triport headphones yesterday ,neg
AT_USER NOOOOOOO WAYYYYYY  AWWW ,neg
AT_USER  3aaah mosh 3aref a facebook any more ,neg
AT_USER    Not gonna lie  now I want some marshmallows    ,neg
AT_USER I can imagine   the event was a success    I wish I could be there    ,neg
successful nga enlistment ko i got all the classes i needed in just one day i just didnt get what i wanted by the end of the day  ,neg
Conferance calling all morning    yeah ,neg
Trying to get motivated  I have to go to the doctor hope this doesn t take forever ,neg
gltch486  But now the car won t start   oops  ,neg
Driving to get my wisdom teeth removed  ,neg
It just doesnt feel right to not follow what my heart desires      Im in a new place  in a new time      But  Ill humble myself ,neg
All alone at home ,neg
Just woke up    that last tweet was from 3 hours ago  My temp was 99 5 then  now it is 103  how long til I need to go to the ER     ,neg
so torn  love sveta and so happy for her  but dinara so harsh ,neg
AT_USER I ordered this shirt  and then yelled at myself out loud for not getting you one I promise I will in my next batch ,neg
stoked to go up to LA tomorrow for a Birthday Bash   woot   but sad im missing Coachella    ,neg
AT_USER ugh I m looking for my one hitter can t find it ,neg
I really wish Chuck would tell Blair he loved her ,neg
AT_USER She s the ruddy manageress   2nd bad job from her  I can never find a good place beyond 1 or 2 cuts ,neg
AT_USER still waiting to see who our new mayor is  Looks like my fav  couldn t vote  is behind  ,neg
I love when my characters argue with people     but it still makes me all sad ,neg
OMG so unmotivated today   just wanna go back to beddddd     ,neg
wish i was america so could meen nicolous braun  demi  selena and all the other disney people who will go ,neg
my cat needs to stop waking me up so early ,neg
managing keywords without coffee machine ,neg
Stock take tomorrow ,neg
its so cold i miss summer  amp  the sunburnt ness ,neg
I hate Facebook it should be called Spambook   the spam is way worse than Myspace grrrr ,neg
AT_USER Hm  maybe Louise Rennison will break tradition and it will be out in October instead I always order the UK versions anyway,neg
AT_USER Ugh  so far 12 people are definitely coming  It s going to be more of a small get together than a party ,neg
I hate running  May have to get into it though as no gym  no rollerblades and no kickboxing ,neg
AT_USER when is your next show in NYC   I keep missing them ,neg
Worst thing about vacation  No gym I m sprouting a second chin as you re reading this  Mmmmm salt water taffy I ll eat you all  ,neg
Already in bed  My head hurts  ,neg
no time for Twitter this morning  Obscene amount of work to get through ,neg
Ugh  Stiff neck  ,neg
A simply  sad but true statement  Apple s DVD Drives and the DVD player software are total CRAP   ,neg
praying for the passengers and crew of the Air France flight ,neg
fuck  my compy is being attacked by viruses  ,neg
Hoping my books are delivered today  I left my outdated  but still useful  copy of Hillegrass s book   AT_USER house on Tuesday  ,neg
AT_USER I said that sucks  ,neg
cant get the  trvsdjam mixtape to download ,neg
Well if it s just me  militarymon won t trend requires many ppl over period of time  oh well but good stuff good times LOL,neg
AT_USER Then they ll have to get fucking  undiscovered  people or w e ,neg
AT_USER Well FINE  Love you too,neg
ooh lookie  the original spock is there too    intimidating spock 2009     ,neg
i love mamajen  i miss my baby creslee ,neg
There s no booze at this anniversary celebration  ,neg
I think I miss you ,neg
AT_USER Aaawww  indeed  Where re you gonna be ,neg
twitter is trippin  ,neg
Also I have lost taste for food ,neg
soon man   hows t dot DPC  lydia is always too busy to bbm me ,neg
i don t want to go to schooooooool ,neg
AT_USER i heard Coraline is good too   i haven t watched it ,neg
 im gonna miss my psychology sociology teacher,neg
AT_USER I m not so lucky  It only plays intermittently here ,neg
my dogs are standing guard over Babes and won t let the other cats near him     they re keeping a close eye on me too     time to T amp P ,neg
another phone causalty  worst luck ever with these devices bf left so now bff is coming ,neg
Lovely day today  At work from 10 to 5 can t be here for mothers day happy mother s day,neg
AT_USER You re blackberry is wack  Lol    Imma try to PIN you,neg
AT_USER you got a new place in west vil  Now we can hang out actually  Oh wait you work too much ,neg
rain better not ruin my beach plans this weekend ,neg
AT_USER That is so f d up ,neg
AT_USER Oh Sue   I didn t realise that it was your door So sorry   will her insurance cover it  You not hurt ,neg
AT_USER no Tanka Bars at the Boise Coop The girl I talked to said  quot I am not sure WHAT happened to those quot   Darn it ,neg
AT_USER You lucky bastard ,neg
goodmorning  i m very tired i want to go back to sleep again   but i can t ,neg
AT_USER Lol    ur not seriOus  are u mocking me or what  do u knOw how celebritish i am  hiss   ,neg
Home and going to bed   I don t feel well  ,neg
iis really down i need JLS site to work cant liive with out iit lol who fills the same xxxx,neg
AT_USER by any chance r u guys members of other groups put together     btw it sucks that chick fil a isn t open sry ,neg
AT_USER they messed everything up ,neg
Still feeling sick  cant really stomach anything  just pops out again ,neg
Not so keen on CSS that won t play nice     and then the exact same code decides to work two hours later ,neg
My laptop won t work  think hard drive is screwed  Maybe it heard me talking about replacing it  and is teaching me a lesson  ,neg
AT_USER oh Randaroo    where have you been lately  You ve been missing my costume progress   er    quot progress quot ,neg
No matter how many times I get given  quot coffee tea quot  at work  I m still not loving the taste  ,neg
AT_USER I dont hav  75 go on piknic,neg
Just bought a  quot for sale quot  sign for my car  ,neg
Driving home from a beautiful day ,neg
cars in the shop but im driving a Charger as a rental ,neg
AT_USER Dew locator cannot find Game Fuel at any store within a 50 mile radius of 28711  ,neg
AT_USER BOOOOOO don t remind me my TOES feel the affect of old age whenever i wear heels soon i ll be clubbin in CROCS ,neg
AT_USER I keep missing the anon posts because I m never at home when they re active  ,neg
Watching oltl i dont think starr and cloe r on ,neg
Okay now there making me feel bad about having to come get it boo,neg
AT_USER poor honey Have you been to doctor already  ,neg
AT_USER Awww   ,neg
Finally   my bed ,neg
Improvaganza  With Sabrina  Oh free tickets don t actually apply ,neg
fucking long ass time  Feel like im not good enough or just plain old used  w e  time to get over him i guess ,neg
AT_USER well count sheep bitch  haha im waiting to brush my teeth  gt _ lt ,neg
Ouch i got a boo boo on my finger and it really hurts    I cut myself with scissors and its bleeding,neg
IS MONDAY   ,neg
aww no the man who is the voice of mickey mouse died   i know im probbably last to know  its so sad ,neg
it hurts  ,neg
Weirrrddoo   Lg sebel tp harus berada di satu tempat dan on meeting   Huh  ,neg
is sendirian dirumah URL,neg
Could have slept for at least another two hours ,neg
AT_USER i m sad for you   wheress AT_USER you guys need to meeet    he d love you,neg
AT_USER poor baby     you could be melting at work    i m so hot  my arms are sticking to my desk  ,neg
My eye problem is the beginning of a sty  Horrible gooey  gluey eye cream is required ,neg
Ness  do u still want a ride from the Riv  This evening    Erik s BBQ caught fire ,neg
I was playing with my dog Angel at the tower when someone made fun of me for being Half Elf  I hate racist people ,neg
I was just car shopping browsing and I suddenly wished I had a copious amount of money so I can buy a new  not used  car  ,neg
